{
  "schema": "cwk.rt055.amendment13-deployment.v1",
  "archived_source_files": 27,
  "builder_runs": 1,
  "executioner_migration_id": "a5769e70-da2f-447a-84ea-6ba1c21a2eca",
  "global_exposure": 0,
  "historical_bytes_equal": true,
  "historical_prior_files_verified": 390197,
  "history_files_verified": 390258,
  "new_window_id": "be602a43-c84f-4d02-94fa-10cdb7ad268b",
  "old_after_retried": false,
  "old_after_status": "FAIL",
  "old_window_id": "999c334f-5018-4d83-b571-b406f49fe605",
  "previous_archive_bytes_equal": true,
  "previous_archived_files": 27,
  "retained_bytes_equal": true,
  "retained_files": 96,
  "run_id": "ac1ca0c7-6983-4f6e-91ce-8eb45e7673af",
  "scoring_archive_id": "0ed37551-86f9-478e-a3dd-a422faa5d477",
  "source_commit": "982da5492cfcd7c56719c5e29f1fc075dbab4983",
  "source_files_changed": [
    "rt055_runtime.py",
    "rt055_confidentiality.py",
    "rt055_zero_exposure.py",
    "rt055_candidate_startup.py",
    "rt055_log_firewall.py",
    "rt055_workload_readiness.py"
  ],
  "status": "ARCHIVED_AND_DEPLOYED",
  "verifier_runs": 1,
  "workload_authorized_runs": 1,
  "workload_reason": "SOURCE_BINDING_REQUIRES_NEW_WORKLOAD",
  "original_deployment_precheck_status": "FAILED_PRESERVED",
  "original_failure_stage": "PRECHECK",
  "original_failure_reason": "HISTORICAL_PREDICATE_VERSION_MISMATCH",
  "original_source_installs": 0,
  "original_current_privacy_invocations": 0,
  "append_only_resolution": "SOURCE_BOUND_ORIGINAL_PREDICATE_VERIFIED",
  "first_source_install_verified": true,
  "original_failure_overwritten": false,
  "current_gate_failure_retried": false
}
